{
  "id": "core",
  "name": "Core",
  "summary": "HealthOS law-bearing contracts for identity, habilitation, consent, finalidade, gate, provenance, storage law, and lawfulContext.",
  "maturity": "tested operational path",
  "canonicalDocs": [
    "HealthOS/Shared/docs/architecture/01-overview.md",
    "HealthOS/Shared/docs/architecture/05-data-layers.md",
    "HealthOS/Shared/docs/architecture/06-core-services.md",
    "HealthOS/Shared/docs/architecture/17-glossary.md",
    "HealthOS/Shared/docs/execution/10-invariant-matrix.md"
  ],
  "primaryPaths": [
    "HealthOS/Tier1-Mestral-Core/Sources/HealthOSCore"
  ],
  "secondaryPaths": [
    "HealthOS/Tier1-Mestral-Core/Schemas/contracts",
    "HealthOS/Tier1-Mestral-Core/Schemas/entities",
    "HealthOS/Shared/docs/execution/skills/core-law-skill.md",
    "HealthOS/Shared/docs/execution/skills/core-governance-skill.md",
    "HealthOS/Shared/docs/execution/todo/core-laws.md"
  ],
  "forbiddenPaths": [
    "HealthOS/Tier4-Stages-Cast/Scribe/Sources/Scribe",
    "HealthOS/Tier4-Stages-Cast/Veridia/Sources/Veridia",
    "HealthOS/Tier4-Stages-Cast/CloudClinic/Sources/CloudClinic",
    "HealthOS/Constructor/ts/agent-infra"
  ],
  "invariants": [
    "HealthOS Core remains sovereign for consent, habilitation, finality, gate, provenance, storage law, and lawfulContext.",
    "AACI, GOS, apps, providers, and construction tooling consume Core-mediated surfaces and never become Core law.",
    "Drafts do not become final artifacts without approved gate resolution.",
    "Scaffold maturity must never be described as production readiness."
  ],
  "allowedWork": [
    "Maintain Core governance contracts and fail-closed validators.",
    "Update Swift, TypeScript, JSON Schema, and SQL mirrors together when a Core contract changes.",
    "Add or repair tests that prove Core boundary behavior.",
    "Clarify official docs when Core sovereignty or maturity wording drifts."
  ],
  "forbiddenWork": [
    "Move Core law into apps, AACI, GOS, providers, or construction tooling.",
    "Weaken consent, habilitation, gate, finality, provenance, or lawfulContext checks.",
    "Treat app UI, GOS policy, or provider output as clinical authority.",
    "Claim production readiness, full EHR status, or real regulatory/provider integration."
  ],
  "validationCommands": [
    "make swift-build",
    "make swift-test",
    "make validate-contracts",
    "make validate-schemas",
    "make validate-all"
  ],
  "knownGaps": [
    "Production clinical, regulatory, provider, and interoperability integrations remain out of scope.",
    "Some Core contracts are scaffolded or tested operational paths rather than production-hardened systems."
  ],
  "defaultSettlerIds": [
    "core-settler"
  ],
  "relatedTerritoryIds": [
    "storage-and-data",
    "aaci",
    "gos",
    "apps",
    "regulatory-and-interoperability"
  ],
  "notes": [
    "Territory records are construction metadata only; official docs remain canonical.",
    "Any Core change has high blast radius and should include contract and validation updates."
  ]
}
