{
  "id": "regulatory-and-interoperability",
  "name": "Regulatory and Interoperability",
  "summary": "Regulatory audit, emergency access, legal retention, digital-signature scaffold, interoperability package governance, and no-false-compliance posture.",
  "maturity": "scaffolded contract",
  "canonicalDocs": [
    "HealthOS/Shared/docs/architecture/39-regulatory-interoperability-signature-emergency-governance.md",
    "HealthOS/Shared/docs/architecture/06-core-services.md",
    "HealthOS/Shared/docs/architecture/46-apple-sovereignty-architecture.md",
    "HealthOS/Shared/docs/execution/10-invariant-matrix.md",
    "HealthOS/Shared/docs/execution/14-final-gap-register.md",
    "HealthOS/Shared/docs/execution/skills/regulatory-interoperability-skill.md"
  ],
  "primaryPaths": [
    "HealthOS/Tier1-Mestral-Core/Sources/HealthOSCore/RegulatoryGovernance.swift",
    "HealthOS/Tier1-Mestral-Core/Schemas/contracts/regulatory-interoperability-signature-emergency-governance.schema.json"
  ],
  "secondaryPaths": [
    "HealthOS/Tier1-Mestral-Core/SQL/migrations/001_init.sql",
    "HealthOS/Shared/docs/execution/todo/core-laws.md",
    "HealthOS/Shared/docs/execution/todo/data-storage.md"
  ],
  "forbiddenPaths": [
    "HealthOS/Tier2-GOS-Runtimes/Sources/HealthOSAACI",
    "HealthOS/Tier4-Stages-Cast/Scribe/Sources/Scribe",
    "HealthOS/Tier4-Stages-Cast/Veridia/Sources/Veridia",
    "HealthOS/Tier4-Stages-Cast/CloudClinic/Sources/CloudClinic",
    "HealthOS/Constructor/ts/agent-infra"
  ],
  "invariants": [
    "Core remains sovereign for regulatory contracts and gate-required effects.",
    "AACI, GOS, apps, providers, and construction tooling are not regulatory authorities.",
    "Emergency, signature, audit, retention, and interoperability pathways must fail closed without required basis, scope, rationale, lawfulContext, and gate where applicable.",
    "Scaffold signature/interoperability records are not real legal integrations."
  ],
  "allowedWork": [
    "Maintain regulatory, emergency, signature, retention, and interoperability scaffold contracts.",
    "Add fail-closed validation tests and schema alignment.",
    "Clarify docs to avoid compliance or certification overclaims.",
    "Record legal/provider endpoint gaps explicitly."
  ],
  "forbiddenWork": [
    "Claim regulatory compliance, production certification, or final legal authority.",
    "Claim real ICP-Brasil, RNDS, TISS, FHIR, or qualified signature integration without implementation and evidence.",
    "Use construction tooling as regulatory authority.",
    "Simulate legal-valid evidence or signature success."
  ],
  "validationCommands": [
    "make swift-build",
    "make swift-test",
    "make validate-schemas",
    "make validate-contracts",
    "make validate-docs",
    "make validate-all"
  ],
  "knownGaps": [
    "Real qualified signature provider integration is absent.",
    "Real regulatory and interoperability endpoint integrations are absent.",
    "Production certification remains out of scope."
  ],
  "defaultSettlerIds": [
    "regulatory-settler"
  ],
  "relatedTerritoryIds": [
    "core",
    "storage-and-data",
    "apps",
    "operations-and-observability"
  ],
  "notes": [
    "This territory preserves explicit non-claims as much as implementation contracts.",
    "Territory metadata does not create legal effect."
  ]
}
